<?xml version="1.0" encoding="ISO-8859-1"?>
<!DOCTYPE quicksec PUBLIC "quicksec:dtd" "quicksec.dtd">


<!-- Peer-to-peer setup using both normal and combined -->
<!-- mode cipher (AES-CBC and AES-GCM) -->
<!-- Related: hosta-dual-proposal.xml -->
<quicksec>
  <params>
    <http-interface/>

    <!-- Authentication domain specifies IKE authentication
         parameters -->
    <auth-domain>
      <!-- shared secret and identity of remote IKE peer -->
      <remote-secret id-type="email" 
                     id="a@ipsec.com">foo</remote-secret>
    </auth-domain>
  </params>
  <policy>

    <tunnel name="host-to-host" transform="aes-gcm aes sha1 esp"
	    flags="auto">
      <!-- local identity sent to the remote IKE peer -->
      <identity id-type="email" id="b@ipsec.com">
        <!-- local shared secret -->
        <local-secret>foo</local-secret>
      </identity>
      <ike-algorithms>aes sha1</ike-algorithms>
    </tunnel>

    <!-- Allows src address to initiate traffic to the dst address,
         packet matching to these selectors triggers IKE negotiation.
         Protocol/port information can be encoded in the traffic
         selector as ipv4(protocol:port,a.b.c.d) -->
    <rule to-tunnel="host-to-host">
      <src>ipv4(172.30.4.167)</src>
      <dst>ipv4(172.30.4.189)</dst>
    </rule>

    <!-- Allows src address to initiate traffic to the dst address, 
         if the packet came from the specified from-tunnel.
         Protocol/port information can be encoded in the traffic
         selector as ipv4(protocol:port,a.b.c.d) -->
    <rule from-tunnel="host-to-host">
      <src>ipv4(172.30.4.189)</src>
      <dst>ipv4(172.30.4.167)</dst>
    </rule>

    <!-- Pass rule, that handles all traffic not matching
         to traffic selectors on any higher precedence rules.
         Remove this rule if plain text traffic is forbidden. -->
    <rule>
      <src>ipv4(0.0.0.0/0)</src>
      <dst>ipv4(0.0.0.0/0)</dst>
    </rule>
  </policy>
</quicksec>
