<?xml version="1.0" encoding="ISO-8859-1"?>
<!DOCTYPE quicksec PUBLIC "quicksec:dtd" "quicksec.dtd">


<!-- Peer-to-peer setup with rsa certificates. -->
<!-- Related: hosta-certificate-rsa.xml -->
<quicksec>
  <!-- to generate the CA and end entity certificates used in this
       sample, please execute 'ssh-certmake cert_template.rsa'
       (found from the src/quicksec/samples directory).
       This will generate the necessary files needed by this policy.
       This operation must be done only on one of the test hosts!
       Copy the generated rsa* files to local and to remote IKE
       peer's directory (where policy manager is located). -->
  <params>
    <!-- local certificate and private key -->
    <externalkey type="software" init-info="key_files(rsauser2.crt, 
                                            rsauser2.prv)"/>
    <auth-domain>
      <!-- Trusted CA -->
      <ca file="rsaca.ca"/>
      
      <!-- static CRL from a file-->
      <crl file="rsaca.crl"/>
    </auth-domain>
  </params>
  <policy>

    <tunnel name="host-to-host" flags="auto">
      <!-- local identity sent to the remote IKE peer -->
      <identity id-type="email" id="rsauser2@ipsec.com"/>
    </tunnel>

    <!-- Allows src address to initiate traffic to the dst address,
         packet matching to these selectors triggers IKE negotiation.
         Protocol/port information can be encoded in the traffic
         selector as ipv4(protocol:port,a.b.c.d) -->
    <rule to-tunnel="host-to-host">
      <src>ipv4(172.30.4.167)</src>
      <dst>ipv4(172.30.4.189)</dst>
    </rule>

    <!-- Allows src address to initiate traffic to the dst address, 
         if the packet came from the specified from-tunnel.
         Protocol/port information can be encoded in the traffic
         selector as ipv4(protocol:port,a.b.c.d) -->
    <rule from-tunnel="host-to-host">
      <src>ipv4(172.30.4.189)</src>
      <dst>ipv4(172.30.4.167)</dst>
    </rule>

    <!-- Pass rule, that handles all traffic not matching
         to traffic selectors on any higher precedence rules.
         Remove this rule if plain text traffic is forbidden. -->
    <rule>
      <src>ipv4(0.0.0.0/0)</src>
      <dst>ipv4(0.0.0.0/0)</dst>
    </rule>

  </policy>
</quicksec>
