<?xml version="1.0" encoding="ISO-8859-1"?>
<!DOCTYPE quicksec PUBLIC "quicksec:dtd" "quicksec.dtd">


<!-- Peer-to-peer setup defining PFS groups. -->
<!-- Related: hosta-pfs-groups.xml -->
<quicksec>
  <params>
    <!-- Authentication domain specifies IKE authentication
         parameters -->
    <auth-domain>
      <!-- shared secret and identity of remote IKE peer -->
      <remote-secret id-type="email"
                     id="a@ipsec.com">foo</remote-secret>
    </auth-domain>
  </params>
  <policy>

    <tunnel name="host-to-host" flags="auto">
      <!-- local identity sent to the remote IKE peer -->
      <identity id-type="email" id="b@ipsec.com">
        <!-- local shared secret -->
        <local-secret>foo</local-secret>
      </identity>
      <!-- allowed MODP groups for IPSec SA negotiation.
           The PFS operation is not performed for initial
           IPSec SA.
           Supported values are 1, 2, 5 and 14 through 26. -->
      <pfs-groups>14 15</pfs-groups>
      <!-- Set the lifetime for IPSec SA to be 5 minutes
           (300 seconds). The default lifetime for IPSec
           SA is 8 hours (28800 seconds). -->
      <life type="seconds">300</life>
    </tunnel>

    <!-- Allows src address to initiate traffic to the dst address,
         packet matching to these selectors triggers IKE negotiation.
         Protocol/port information can be encoded in the traffic
         selector as ipv4(protocol:port,a.b.c.d) -->
    <rule to-tunnel="host-to-host">
      <src>ipv4(172.30.4.167)</src>
      <dst>ipv4(172.30.4.189)</dst>
    </rule>

    <!-- Allows src address to initiate traffic to the dst address,
         if the packet came from the specified from-tunnel.
         Protocol/port information can be encoded in the traffic
         selector as ipv4(protocol:port,a.b.c.d) -->
    <rule from-tunnel="host-to-host">
      <src>ipv4(172.30.4.189)</src>
      <dst>ipv4(172.30.4.167)</dst>
    </rule>

    <!-- Pass rule, that handles all traffic not matching
         to traffic selectors on any higher precedence rules.
         Remove this rule if plain text traffic is forbidden. -->
    <rule>
      <src>ipv4(0.0.0.0/0)</src>
      <dst>ipv4(0.0.0.0/0)</dst>
    </rule>
  </policy>
</quicksec>
